{
  "schema_version": 1,
  "backup_id": "20261009T120000Z-11111111-2222-4333-8444-555555555555",
  "manifest_key": "backups/20261009T120000Z-11111111-2222-4333-8444-555555555555/manifest.json.age",
  "manifest_version_id": "fixture-manifest-version",
  "manifest_ciphertext_sha256": "1111111111111111111111111111111111111111111111111111111111111111",
  "completed_at": "2026-10-09T12:05:01Z"
}
